03.01.23 09:40:51;476463;Habr;Анализ данных на питоне;;3,000;~ 14 часов назад;8;;https://freelance.habr.com/tasks/476463
03.01.23 09:40:51;5095833;FL;Парсер новостных сайтов.;Парсер новостных сайтов. 1. Есть список сайтов, в формате txt, csv, xlsx или другой типа с url новостей, названием источника и идентификатором доступа к контенту (свободный или...;По договоренности;Заказ 8 минут назад;нет ответов;;https://www.fl.ru/projects/5095833/parser-novostnyih-saytov.html
03.01.23 09:40:51;5095810;FL;Контент-менеджер. Авиабилеты;Нужно заполнить таблицу данными об авиабилетах, собранными с разных агрегаторов;1,200 руб;Заказ 19 минут назад;2 ответа;;https://www.fl.ru/projects/5095810/kontent-menedjer-aviabiletyi.html
03.01.23 09:40:51;1464777;Freelance;автокликер копипаст из эксель в вэб и обратно;ТЗ на видео - https://dropmefiles.com/RMvFO если кого то смущает файлобменник, пришлю в ТГ или на почту.  В двух словах - есть несколько тысяч строк в эксель, три вида данных, которые нужно переносить (копировать) в вэб...;Договорная;2023-01-03 в 03:36;Откликов: 6;Срок выполнения: 2 дня;https://freelance.ru/projects/avtokliker-kopipast-iz-eksel-v-veb-i-obratno-1464777.html
03.01.23 10:59:56;5095880;FL;Сделать отчет в access;Есть 10 таблиц в access. В каждой таблице 5-8 значений на определенную дату, которые заполняются разными людьми. Необходимо сделать единый отчет по всем показателям (5-8) из...;По договоренности;Заказ 6 минут назад;нет ответов;;https://www.fl.ru/projects/5095880/sdelat-otchet-v-access.html
03.01.23 11:42:12;1464797;Freelance;Настроить обмен по I2C между двумя контроллерами ;Имеется 2 контроллера и 2 проекта для них : https://disk.yandex.ru/d/akb6Lh5dOMWKIw Контроллеры: К1986VE92qi и 1986BE1qi 1) power_manager 2)Buss_to_ethernet Основной проект Power_manager (ve92), код написан, необходимо передать данные с 1 ого контроллера( завернутые в массив) на другой...;Договорная;2023-01-03 в 11:41;3;Срок выполнения: 17 дней;https://freelance.ru/projects/nastroit-obmen-po-i2c-mezhdu-dvumya-kontrollerami-1464797.html
03.01.23 12:31:17;5090642;FL;Python разработчик;Здравствуйте!;По результатам собеседования ;Вакансия 40 минут назад;33 ответа;;https://www.fl.ru/projects/5090642/python-razrabotchik.html
03.01.23 12:37:02;5053183;FL;Написать парсер с сайта и сформировать файл эксель;Нужно написать парсер с сайта и сформировать файл эксель с заданными параметрами.;1,500 руб;Заказ Только что;10 ответов;;https://www.fl.ru/projects/5053183/napisat-parser-s-sayta-i-sformirovat-fayl-eksel.html
03.01.23 13:00:26;5095909;FL;Скрипт для обработки папок и файлов;Нужно написать скрипт на PowerShell or Python 3.9 для обработки файлов.  А именно : 1)удаления не нужных файлов с определенным именем(титульный лист, цена сроки), во всех...;1,200 руб;Заказ 24 минуты назад;нет ответов;;https://www.fl.ru/projects/5095909/skript-dlya-obrabotki-papok-i-faylov.html
03.01.23 13:37:28;5095929;FL;Создать простое веб приложение учета данных с переменными и вывод обобщенных данных в графики.;ТЗ Задача написать простое веб приложение учета определенных данных с переменными и вывод обобщенных данных в графики. По примеру, который есть в Гугл таблице со всеми данными...;По договоренности;Заказ Только что;нет ответов;;https://www.fl.ru/projects/5095929/sozdat-prostoe-veb-prilojenie-ucheta-dannyih-s-peremennyimi-i-vyivod-obobschennyih-dannyih-v-grafiki.html
03.01.23 15:34:17;1464839;Freelance;Нужно создать скрипт/бота/макрос для браузерной игры;Нужно создать скрипт/бота/макрос для браузерной игры Есть видео. Пишите в телеграм durazel;Договорная;2023-01-03 в 15:33;3;Срок выполнения: 1 день;https://freelance.ru/projects/nuzhno-sozdat-skript-bota-makros-dlya-brauzernoj-igri-1464839.html
03.01.23 15:37:57;5091247;FL;Доработка гугл таблицы;В гугл таблице необходима кнопка, которая автоматически добавляет блок данных под предыдущим блоком;1,200 руб;Заказ Только что;3 ответа;;https://www.fl.ru/projects/5091247/dorabotka-gugl-tablitsyi.html
03.01.23 15:40:34;1464840;Freelance;Требуется backend-разработчик на Django для разработки системы планирования мероприятий.;Здравствуйте! Требуется backend-разработчик на Python с использованием фреймворка Django, на разработку системы планирования и исполнения мероприятий. Дизайн системы прилагаю (ссылка прикреплена ниже).  Уже реализованы базы данных, роутинг, DRF. Необходимы обработчики форм, вывод контента на страницы,...;Договорная;2023-01-03 в 15:39;3;Срок выполнения: 7 дней;https://freelance.ru/projects/trebuetsya-backend-razrabotchik-django-dlya-razrabotki-sistemi-planirovaniya-1464840.html
03.01.23 15:41:38;1464841;Freelance;Необходимо заполнить таблицу для направления Методическая деятельность (заочка). Вставить в таблицу философов, психологов и педагогов с их подходами, идеями, закономерностями, принципами и технологическим обеспечением. Нужно использовать цитаты их. ;Мой документ ворд уже с таблицей, её нужно заполнить. По 3 философа, психолога и педагога в клеточку. Их позицию взять из их трудов. Ответить на вопрос под таблицей. Всё будет касаться ключевого понятия - методическая...;200 Руб;2023-01-03 в 15:40;1;Срок выполнения: 2 дня;https://freelance.ru/projects/neobhodimo-zapolnit-tablicu-dlya-napravleniya-metodicheskaya-deyatelnost-1464841.html
03.01.23 15:51:37;476541;Habr;Создание аналитического дашборда, в Power BI Desktop;;500;1 минуту назад;0;;https://freelance.habr.com/tasks/476541
03.01.23 15:54:14;476543;Habr;Написать программу на Python;;договорная;1 минуту назад;0;;https://freelance.habr.com/tasks/476543
03.01.23 16:47:57;1464851;Freelance;Университетское задание python + dash;Прошу сделать как можно раньше, поскольку этот проект мне еще будет необходимо согласовать с преподавателем. Также желательно дать пояснения к работе, чтобы я мог ориентироваться в работе и в случае необходимости дать пояснения преподавателю. Обучение...;Договорная;2023-01-03 в 16:47;2;Срок выполнения: 10 дней;https://freelance.ru/projects/universitetskoe-zadanie-python-dash-1464851.html
03.01.23 18:59:39;5096017;FL;Доработка страницы html;Есть база mysql. Скриптом php из базы берутся данные и делается таблица time16.ru/fitness/_workzi... В таблице есть: - кнопка в заголовке - выпадающие списки – в...;По договоренности;Заказ 35 минут назад;5 ответов;;https://www.fl.ru/projects/5096017/dorabotka-stranitsyi-html.html
03.01.23 19:30:54;5096028;FL;Разработать дашборд отдела продаж в Power Bi или Google Data Studio;Необходимо разработать дашборд для управления отделом продаж, работающий в Power Bi или Google Data Studio, с получением данных из Битрикс24 и гугл таблиц. Рассматриваю только...;500 000 руб;Заказ Только что;нет ответов;;https://www.fl.ru/projects/5096028/razrabotat-dashbord-otdela-prodaj-v-power-bi-ili-google-data-studio.html
03.01.23 19:58:00;476575;Habr;Улучшение и стабилизация telegram - бота на python;;2,000;1 минуту назад;0;;https://freelance.habr.com/tasks/476575
03.01.23 20:24:06;5096037;FL;Чекер WhatsApp;Требуется написать микросервис, который будет проверять телефонный номер на наличие на нем мессенджера WhatsApp. Стек технологий для разработки: Python. Микросервис работает с...;5,000 руб;Заказ Только что;нет ответов;;https://www.fl.ru/projects/5096037/cheker-whatsapp.html
04.01.23 00:00:22;476595;Habr;Сделать лабы на питоне;;3,000;1 минуту назад;0;;https://freelance.habr.com/tasks/476595
04.01.23 07:09:45;476599;Habr;Crypto decrypt python;;5,000;~ 6 часов назад;2;;https://freelance.habr.com/tasks/476599
04.01.23 07:09:45;5096127;FL;Конвертация VCF в Excel;Конвертация адресной книги с андроида в Excel.  На русском языке, чтобы все данные читались.;3,000 руб;Заказ 2 часа 35 минут назад;9 ответов;;https://www.fl.ru/projects/5096127/konvertatsiya-vcf-v-excel.html
04.01.23 07:09:45;5096065;FL;телеграм бот на python;нужен телеграм бот который мониторит курсы криптовалют и ценных бумаг, и раз в какое-то время (это можно настраивать) присылает их в чат. так же нужна возможность получить...;По договоренности;Заказ 6 часов 14 минут назад;9 ответов;;https://www.fl.ru/projects/5096065/telegram-bot-na-python.html
04.01.23 07:09:45;1464905;Freelance;разработать таблицу в Excel;Необходимо доработать таблицу либо создать такого функционала таблицу с 0. Макросы должны работать на макбук.;Договорная;2023-01-04 в 06:59;<Response not defined>;Срок выполнения: 1 день;https://freelance.ru/projects/razrabotat-tablicu-v-excel-1464905.html
04.01.23 07:37:22;1464908;Freelance;Подборка логотипов сайтов недвижимости в Канаде;Сделать подборку логотипов и сайтов компаний в сфере недвижимости в Канаде- агентства недвижимости, доски объявлений, компании в сфере коммерческой недвижимости (офисные центры) и другое Не менее 45 штук. Оформить это в виде Excel документа с...;4 500 Руб;2023-01-04 в 07:36;1;Срок выполнения: 11 дней;https://freelance.ru/projects/podborka-logotipov-sajtov-nedvizhimosti-v-kanade-1464908.html
